9680,根据《中华人民共和国合同法》第九十七条的规定，鑫红光公司应当向省建三公司支付已完部分的工程价款，逾期则应支付利息,-1
9692,“发包人未按照约定支付价款的，承包人可以催告发包人在合理期限内支付价款,-1
9693,发包人逾期不支付的，除按照建设工程的性质不宜折价、拍卖的以外，承包人可以与发包人协议将该工程折价，也可以申请人民法院将该工程依法拍卖,-1
9699,但是根据《最高人民法院关于审理建设工程施工合同纠纷案件适用法律问题的解释（二）》第二十一条的规定，建设工程价款优先受偿的范围仅限于工程价款，承包人就逾期支付建设工程价款的利息、违约金、损害赔偿金等不属于优先受偿权的范围，故本院对省建三公司主张停工损失和解除合同的损失享有优先受偿权的诉讼请求不予支持,-1
9702,关于省建三公司要求鑫红光公司承担诉讼保全所支出的保险费用的问题，虽然本案的诉讼是由于鑫红光公司逾期支付工程款的原因所导致，但并非必须申请财产保全，而且诉讼保全担保的方式多种多样，本案中财产保全保险费用并非必须产生的费用，故本院对省建三公司要求鑫红光公司承担诉讼保全保险费用的主张不予支持,-1
9860,《最高人民法院关于审理建设工程施工合同纠纷案件适用法律问题的解释》第十七条规定“当事人对欠付工程价款利息计付标准有约定的，按照约定处理,-1
9880,实际施工人以发包人为被告主张权利的，人民法院可以追加转包人或者违法分包人为本案当事人，发包人只在欠付工程价款范围内对实际施工人承担责任,-1
9893,当事人对欠付工程价款利息计付标准有约定的，按照约定处理,-1
9928,二、中港建设是否存在延期竣工的情形，九华石油主张其承担违约金及赔偿直接经济损失是否应当得到支持,-1
9954,综上，本院根据《工程造价鉴定意见书》（编号CSG0125）/JD/002/02）的意见，确认反诉被告九华石油公司应向反诉原告中港公司欠付的工程款计算如下,-1
9962,3、工程签证单025，建设单位签署意见“有少量超深地基有抽水现象，但施工方未及时报告监理和建设方签证且附表中机械台班量虚报量极大，须与建设单位协商解决”,-1
9968,9、工程签证单034，建设单位签署意见“人工挖孔桩无需大中型机械设备，基础超深系与相邻周边周期延续施工，以上内容不予认可”10、工程签证单035，建设单位签署意见“抽水时间虚报量过大，且未及时向监理和建设单位报告签认，须与建设单位协商解决”,-1
9979,现因原、被告对原告实际使用的时间存在争议的情形，故本院对工程延长工期后被告是否存在逾期完工的行为无法予以认定，为此对于原告请求被告支付迟延竣工违约金以及赔偿直接经济损失290000元的诉讼请求不予支持,-1
9990,詹永顺请求物资中心在欠付工程款范围内对上述欠款承担连带清偿责任，根据《最高人民法院关于审理建设工程施工合同纠纷案件适用法律问题的解释》第二十六条“实际施工人以转包人、违法分包人为被告起诉的，人民法院应当依法受理,-1
9992,发包人只在欠付工程价款范围内对实际施工人承担责任”和该解释其他条文规定，实际施工人请求发包人承担责任的要件有二,-1
9994,2.发包人欠付工程款,-1
9995,构成上述要件后，发包人只在欠付工程价款范围内对实际施工人承担责任,-1
10011,二、涉案工程造价及被告泰隆公司所欠付工程款数额,-1
10013,四、反诉原告泰隆公司主张反诉被告恒生源公司支付擅自停工违约金13282480.44元及因工期延误导致逾期交房所造成的经济损失31586090.39元，应否支持,-1
10050,关于原告主张应自起诉之日2014年7月23日起计算利息的起算时间问题，本院认为，鉴于本案原告起诉之前，涉案工程已经停工，系诉讼期间经双方协商，并在行政主管部门的协调下，原告复工建设，并于2016年4月6日通过竣工验收，对于截止起诉之日，被告欠付工程款数额，原告未提供有效证据证实，故原告主张被告应自起诉之日，即2014年7月23日起计算欠付工程款的利息，于法无据，本院不予支持,-1
10051,本院认为，欠付工程款利息应自竣工验收之日，即2016年4月6日起计算为宜,-1
10055,关于反诉原告主张反诉被告因工期延误导致逾期交房所造成的经济损失31586090.39元问题，对此反诉被告恒生源公司不予认可，反诉原告亦未提供证据证实其损失的实际发生，故其该主张，本院不予支持，反诉原告可待证据充分后另案主张权利,-1
10099,本院认为，根据被告提供的证据证实，涉案工程的结构（基础）、结构（主体）及建筑装饰装修的部分已经于2014年1月5日通过原告、设计单位、监理单位的分项验收，而原告出具的《翁垟综合楼安置房居民要求预验收申请报告》也证实2014年1月5日其便向乐清市建设工程质量监督站要求对涉案工程进行预验收，说明涉案工程在2014年1月5日前已经完工，原告在原审中也予以认可，但是2014年1月5日距离约定的竣工日2013年12月9日仍延期了17天，对此，被告抗辩是原告逾期支付工程款导致，本院认为，被告单方面以《建设工程施工合同》中约定的付款时间认为原告逾期支付工程款，其抗辩理由不成立，本院不予支持,-1
10225,1、因设计变更已延期工期确认为合理工期,-1
10365,违约金方面，双方签订的《建设工程施工合同》约定，工程质量检验合格后45天内，甲方无正当理由不按时结清款项的，每日按所欠的工程价款的千分之一付给乙方违约金,-1
10390,四、本案中应付工程款、已付工程款、欠付工程款数额是多少,-1
10449,2、工程款支付，按约定乙方报送工程量七日内付款，若因甲方逾期支付工程款超过15天，甲方应承担违约责任，逾期支付工程款的违约金按每日千分之三计取，作为赔偿给乙方的损失,-1
10450,如逾期支付的工程款超过30天，乙方有权停工,-1
10532,四、本案中应付工程款、已付工程款、欠付工程款数额问题,-1
10547,邓州泰和公司欠付工程款数额应为5258935.48元（13276563.66元－663828.18元－7353800元）,-1
10551,综上，河南建安公司请求支付欠付工程款的理由正当，本院予以支持，其他请求不能成立，本院不予支持,-1
10672,根据承包合同第十款第3条约定延期违约每日罚款10000万元（原文如此）计155万元,-1
10673,另根据补充协议第1条约定延期违约每日每幢罚款2000元计124万元,-1
10674,按合同约定共计处罚工期延期违约金279万元,-1
10809,后由于时空公司、南洋公司的工程款没有及时到位及变更设计导致工程延期,-1
10848,现根据合同约定，工程已实际延期且南洋公司已就工程延期一事要求闽中公司承担责任，由于工期的延期是吴东安在施工过程中造成的，吴东安与闽中公司签订有合同，因而南洋公司对闽中公司工期延期的处罚理应由吴东安承担,-1
10849,本院认为，因《建筑工程内部承包施工合同》、《工程项目施工内部承包合同》无效，南洋公司与闽中公司（吴东安施工队）签订的《停车区综合楼内部承包施工合同补充协议书2》因吴东安不具有施工资质同属无效，因此关于工期延期违约的约定无效，且南洋公司是否实际在与闽中公司结算工程款中扣除违约金279万元也未提供相应的证据，故闽中公司要求违约金由吴东安承担的主张，不予支持,-1
10853,南洋公司仅向闽中公司支付11983300元，合同剩余款项没有支付，南洋公司应在其欠付工程款范围内承担付款责任，南洋公司应该支付所欠工程款7724244.3元，由于时空公司承担全部南洋公司与闽中公司的全部权利与义务，所以南洋公司、时空公司、闽中公司应对拖欠吴东安的工程款承担连带责任,-1
10855,南洋公司已要求对闽中公司处罚工期延期违约金279万元并要求闽中公司支付超支的代垫材料款及施工班组借款等109，867元（两项共计2899867元）,-1
10856,"其它款项均已支付给闽中公司，除保修责任和闽中公司应赔偿时空公司、南洋公司工程延期损失外,时空公司、南洋公司与闽中公司的施工合同已决算完毕",-1
10859,发包人只在欠付工程价款范围内对实际施工人承担责任”之规定，时空公司作为涉案工程发包人，除了吴东安认可的时空公司已支付闽中公司工程款11983300元外，未提供证据证实已将涉案工程款全部支付给闽中公司，故其在欠付工程价款范围内对吴东安承担责任,-1
10866,涉案工程2012年11月20日经竣工验收，闽中公司欠付吴东安工程款的利息按照中国人民银行发布的同期同类贷款利率从2012年11月21日起计付,-1
10867,时空公司作为涉案工程发包人，在欠付工程款范围内对吴东安承担责任,-1
10874,一、被告应当支付原告工程款的数额及是否应当支付逾期付款利息？二、被告是否应当向原告支付《建设工程施工合同》及其补充协议履行后可以获得的利益及其数额？三、原告对诉争工程折价或拍卖或变卖所得价款是否享有优先受偿权？四、被反诉人（原告）已完成工程的工程款的具体数额？五、被反诉人是否应当支付反诉人的经济损失？,-1
10876,关于争议焦点一，被告应当支付原告工程款的数额及是否应当支付逾期付款利息？依据《中华人民共和国合同法》第五十八条的规定，合同无效或者被撤销后，因该合同取得的财产，应当予以返还,-1
10881,《最高人民法院关于审理建设工程施工合同纠纷案件适用法律问题的解释》第十七条、第十八条第二款第三项之规定:当事人对欠付工程价款利息计付标准有约定的，按照约定处理;没有约定的，按照中国人民银行发布的同期同类贷款利率计息,-1
10885,本案中，因《建设工程施工合同》无效，违约条款也无效，合同中对欠付工程价款利息计付标准的条款不能适用，涉案工程未最后完工，双方也未对工程款进行过结算，因此，未付工程款的利息应当从一建公司向法院起诉之日起按照中国人民银行发布的同期同类贷款利率计算至实际履行之日,-1
10889,但优先受偿的范围为建设工程应当支付的工作人员报酬、材料款等实际支出的费用，不包括承包人因发包人违约所造成的损失，故逾期支付工程款所产生的利息不在优先受偿的范围内,-1
10940,根据上述证据，可以认定双方达成终止合同履行，并一致确认地金公司已完成的工程总价款、已付款项、欠付款项以及付款期限、工程发票、竣工验收义务、逾期付款责任等内容,-1
10964,如到期汇都公司不能按本协议约定的期限支付工程款，应从工程结算书签订之日起按每日1‰承担欠付工程款的资金占用期间的损失,-1
10966,经本院前述认定的事实，《工程款付款协议书》为双方的最终结算，应以该协议书约定的应付款期限作为承担逾期还款责任的起始时间,-1
10967,虽然《工程款付款协议书》约定应从工程结算书签订之日起按每日1‰承担欠付工程款的资金占用损失，但双方签订了数份工程结算书，付款协议书约定的“工程结算书”为哪一份并未明确，鉴于2017年10月25日签订的《工程结算书》对付款时间未约定，亦不属最终结算，故应以《工程款付款协议书》约定的第一笔付款时间即2018年2月12日作为计算资金占用损失的起始节点较为适当,-1
10968,至于资金占用损失的计算标准，由于该付款协议书明确约定汇都公司不按期支付工程款应按每日1‰承担欠付工程款的资金占用期间的损失，汇都公司本应依照约定承担赔偿责任,-1
10973,二、地金公司应否在欠付工程款范围内对案涉工程享有优先受偿的权利,-1
10974,本院认为，《中华人民共和国合同法》第二百八十六条规定，发包人未按照约定支付价款的，承包人可以催告发包人在合理期限内支付价款,-1
10975,发包人逾期不支付的，除按照建设工程的性质不宜折价、拍卖的以外，承包人可以与发包人协议将该工程折价，也可以申请人民法院将该工程依法拍卖,-1
10978,因此，建设工程价款优先受偿权是承包人的一项法定权利，在发包人未按期支付工程款时，承包人就所建工程折价或拍卖后享有优先受偿权,-1
10983,因此，可以认定地金公司在汇都公司欠付工程款范围内对案涉工程享有优先受偿的权利,-1
10986,此外，根据《最高人民法院关于审理建设工程施工合同纠纷案件适用法律问题的解释（二）》第二十一条第二款“承包人就逾期支付建设工程价款的利息、违约金、损害赔偿金等主张优先受偿的，人民法院不予支持”以及《最高人民法院关于建设工程价款优先受偿权问题的批复》第三条“建筑工程价款包括承包人为建设工程应当支付的工作人员报酬、材料款等实际支出的费用，不包括承包人因发包人违约所造成的损失”的规定，汇都公司向地金公司赔偿的资金占用损失不属工程价款范围，故地金公司就所建工程享有的优先受偿权应仅限于剩余工程价款17284994元范围之内，而不及于资金占用损失,-1
10993,鉴于汇都公司未按照约定履行付款义务，构成违约,-1
11013,汇都公司未按照约定履行支付剩余工程款的义务，违反诚信原则,-1
11019,2．喀什东方汇科公司欠付喀什华厦公司工程款金额及利息如何认定,-1
11021,4．喀什东方汇科公司主张喀什华厦公司应承担逾期交工违约金4120603.58元的反诉请求能否成立,-1
11045,二、关于喀什东方汇科公司欠付喀什华厦公司工程款金额及利息如何认定的问题,-1
11056,（一）关于喀什东方汇科公司欠付喀什华厦公司工程价款数额认定的问题,-1
11122,故依据涉案1号楼、2号楼、22号楼的《建设工程施工合同补充协议》约定，本院认定喀什东方汇科公司实际欠付喀什华厦公司涉案1号楼、2号楼、22号楼项目合计工程价款（包干价含税）=涉案1号楼、2号楼、22号楼合计工程价款（包干价含税）81156818.89元-喀什东方汇科公司向喀什华厦公司已支付工程款20974350.50元-4057840.95元质保金=56124627.44元,-1
11123,（二）关于喀什东方汇科公司欠付喀什华厦公司工程款的利息认定的问题,-1
11127,双方又未达成延期付款协议，导致施工无法进行，承包人可以停止施工，由发包人承担违约责任,-1
11143,故本院对原告喀什华厦公司要求被告喀什东方汇科公司支付其欠付原告喀什华厦公司工程款利息的诉讼请求予以支持,-1
11144,（2）关于喀什东方汇科公司欠付喀什华厦公司工程款利息应如何计算的问题,-1
11146,发包人不安合同约定支付工程款，双方又未达成延期付款协议，导致施工无法进行，乙方可停工，由发包方负责,-1
11158,第六，本案中，喀什华厦公司按每日利息0.00025861113的2倍为标准主张欠付工程款利息，未超出同期中国人民银行贷款基准利率的四倍，符合法律规定和合同约定，应予以支持,-1
11159,综上所述，本院认定喀什东方汇科公司欠付喀什华厦公司工程款利息起算时间为2018年8月20日，截止于本案立案之时即2019年7月25日，共计335天,-1
11160,喀什东方汇科公司欠付喀什华厦公司工程款的利息为9724683.73元（本金56124627.44元×每日利息0.00025861113×2×335天，时间起自2018年8月20日止于2019年7月25日）,-1
11165,四、关于喀什东方汇科公司主张喀什华厦公司应承担逾期交工的违约金4120603.58元的反诉请求能否成立的问题,-1
11168,双方又未达成延期付款协议，导致施工无法进行，承包人可以停止施工，由发包人承担违约责任,-1
11171,故喀什东方汇科公司主张由喀什华厦公司承担逾期交工的违约金4120603.58元的反诉请求，没有事实和法律依据，其该项反诉请求不能成立，应当不予支持,-1
11209,（四）关于西北电缆公司欠付工程款付款条件是否成就的问题,-1
11210,合同中双方对付款的约定为“承包人进场后支付合同总价款的20%作为预付款，工程验收合格后，支付工程总量价款剩余部分的70%，待工程质量保修期满后付清余款的10%”，争议工程于2014年7月20日竣工，根据合同约定工程竣工后西北电缆公司应组织验收，但西北电缆公司未组织验收，后工程投入使用，视为工程合格，根据竣工时间计算一年保修期也已届满，争议工程欠付工程款付款条件均已成就,-1
11266,另二被告还提出原告是以个人名义承建案涉工程，应当按照12%的比例扣除税费、管理费等费用的辩解意见，因前述已确认本案中原、被告之间的事实建设工程施工合同关系无效，在承建工程质量合格的情况下，原告楼应彪可主张实际的工程造价，但不可主张欠付工程款利息、违约金等费用，实际已对其无效施工行为进行了否定和制约，现二被告再据此主张扣除管理费、税费等费用，缺乏合理性，本院不予采信,-1
11282,此外，依照《最高人民法院关于审理建设工程施工合同纠纷案件适用法律问题的解释（二）》第二十一条第二款“承包人就逾期支付建设工程价款的利息、违约金、损害赔偿金等主张优先受偿的，人民法院不予支持,-1
11307,“当事人对欠付工程价款利息计付标准有约定的，按照约定处理,-1
11341,四、被告工程是否存在延期，如存在延期则违约金应如何计算,-1
11363,在此情况下，原告主张被告逾期完工，其应提供证据证明双方另行就工程的完工时间进行了明确的约定,-1
11410,单栋楼移交全部工程竣工资料并五大责任主体验收完成工作，每延误1天，承包人承担逾期竣工违约金20000元,-1
11411,工程移交发包人、配合发包人和物业公司完成向小业主交房工作，每延误1天，承包人承担逾期竣工违约金20000元,-1
11430,三、关于华宇广泰辩称已在二期结算造价汇总表中就逾期竣工违约金协商过扣除20000元，不应再扣除违约金问题,-1
11431,本院认为，从二期结算造价汇总表上可以看出来，华宇广泰在工程“安装”阶段应当承担的罚款或违约金，经过双方协商按20000元计算，此与鸿丰公司依据《建设工程施工合同补充协议》9.6.2.1.3条、9.6.2.1.4条主张的逾期竣工违约金，具有不同的指向,-1
11433,其次，《建设工程施工合同补充协议》9.6.2.1.3条、9.6.2.1.4条（第44页）规定“单栋楼移交全部工程竣工资料并五大责任主体验收完成工作，每延误1天，承包人承担逾期竣工违约金2万元”、“工程移交发包人、配合发包人和物业公司完成向小业主交房工作，每延误1天，承包人承担逾期竣工违约金2万元”,-1
11439,五、关于华宇广泰是否存在逾期竣工的问题,-1
11445,工程师在收到报告后14天予以确认，逾期视为同意顺延工期”、第14条“承包人必须按照协议书约定的竣工日期或工程师同意顺延的工期竣工”，工期顺延的举证责任在华宇广泰，若华宇广泰认为在施工过程中存在工期顺延情形，应承担举证责任，否则，应承担对其不利的法律后果,-1
11446,六、关于鸿丰公司是否存在逾期支付工程款的违约行为问题,-1
11450,华宇广泰在其民事反诉状中自认鸿丰公司已支付工程款61595658元，已经超出了鸿丰公司依据合同规定的工程款进度支付条款所要求的累计支付比例，故鸿丰公司不存在逾期支付工程款的违约行为,-1
11451,七、关于逾期竣工违约金的计算问题,-1
11452,根据《建设工程施工合同补充协议》第9.6.3条“因承包人原因导致工期延误”条款，关键节点工期中，“移交全部工程竣工资料、五大责任主体验收完成”时间，单栋楼每延误1天，承包人承担逾期竣工违约金20000元,-1
11453,关键节点工期中，“工程移交发包人、配合发包人和物业公司完成向小业主的交房”时间，单栋楼每延误1天，承包人承担逾期竣工违约金20000元,-1
11458,以上，华宇广泰应当向鸿丰公司支付的5#、6#楼“移交全部工程竣工资料、五大责任主体验收完成”的违约金22440000元，与鸿丰公司尚欠华宇广泰的3359178.26元工程款（含质量保修金3310000元）冲抵后，华宇广泰还应向鸿丰公司支付违约金19080821.74元，鸿丰公司仅要求华宇广泰承担99万元逾期竣工违约金，系对己方权利的处分，符合法律规定，本院予以准许,-1
11566,”的规定，欠付工程款利息以工程欠款8381684.12元为基数，按照中国人民银行同期同类贷款利率计算，从起诉之日即2016年9月24日起计至还清之日止,-1
11570,国都公司提出天泽公司未按期支付工程款导致其停工，因此天泽公司应赔偿其直接经济损失的主张，经上述争议焦点分析，本案履行的是天泽公司与国都广西分公司签订的《建设工程施工补充合同》，即由施工单位即国都广西分公司垫资施工，若因资金问题而造成的经济损失，应由国都公司及其广西分公司自行负担,-1
11600,原告冯继平按照合同约定的工期垫资完成施工项目，建设工程质量符合质量要求，竣工验收合格，被告胥志明违反诚实信用原则，未按合同约定与原告冯继平结算支付工程价款，考虑到承包人在施工中投入了大量资金、原材料、人力等因素，合同双方均将建设工程作为未来收入的主要保障，信赖和协作是施工合同的主要特征，根据双方在合同履约中的利益衡平原则，为了维护建筑市场的正常秩序，原告请求按约定利率标准承担逾期支付工程款资金利息的诉讼请求，本院予以支持,-1
11607,综上所述，原告冯继平个人与被告胥志明个人签订了《建设工程施工合同》，原告冯继平是“水榭阳光”商住楼项目工程的实际施工人，自行组织人力、物力、财力垫资施工完成合同所约定的施工项目，其建筑质量经验收合格，被告胥志明是“水榭阳光”商住楼项目的实际投资人，负有与建筑工程承包人结算支付工程价款的合同义务，原、被告签订的《建设工程施工合同》虽然无效，但其工程质量经竣工验收为合格，原告冯继平请求按双方约定价款支付工程款，并按约定利率标准承担逾期资金利息及工程价款享有优先受偿权的诉讼请求符合法律规定，原告冯继平未完工程量以及实际领取的价款应予扣减，为了维护建筑业的正常秩序，依照《中华人民共和国合同法》第五十二条第五项、第五十八条、第六十条、第二百六十九条、第二百七十六条、第二百七十九条、第二百八十六条及最高人民法院《关于审理建设工程施工合同纠纷案件使用法律若干问题的解释》第二条、第六条、第十八条，最高人民法院《关于建设工程价款优先受偿权问题的批复》第一项、第二项之规定，判决如下,-1
11610,是否存在欠付工程款,-1
11630,"被告智祥公司抗辩认为，原告二建公司逾期完工，应赔偿工期违约金1,280,000元",-1
11661,其次，对于XX公司是否存在工期超过“房屋可预售节点”的逾期事实和顺延工期的正当理由争议,-1
11662,本院认为，根据有关法律规定，承包人应当按照合同约定完成施工义务，但发包人未按照约定的时间和要求提供原材料、设备、场地、资金、技术资料的，承包人可以顺延工程日期，并有权要求赔偿停工、窝工等损失,-1
11665,本院考量XX公司的违约责任只能基于XX公司的施工进度是否超过了约定的各预售节点以及有否逾期的正当理由,-1
11667,对于2-1号房屋，协议约定为“2007年10月16日开始进行施工，于2007年12月25日达到房屋可预售节点”，即便按XX公司实际取得该房的预售许可证日期，即2008年2月4日，虽存在逾期41天的事实，但一方面，XX公司没有提供其实际申请上述许可证的时间,-1
